neighborhood,neighborhood.lowercase,topic,topic.lowercase,we need more,so i will,city wide
laurelhurst,laurelhurst,housing,housing,rentention of historic housing in neighborhood,care for my historic home,
laurelhurst,laurelhurst,housing,housing,less homelessness.,,
laurelhurst,laurelhurst,housing,housing,cost o housing & / rent control,attend nieghborhood association meeting sto shet light of the subject,
laurelhurst,laurelhurst,housing,housing,"Tree canopy needs to be saved, all homes will be 100 yers old -- 8-10 yrs",work for preservation of both but very careful zoning could be adopted for some lots,
lloyd,lloyd,housing,housing,mixed use development on grand ave + mlk,,
lloyd,lloyd,housing,housing,"lower renting options, less gentrification",be able to afford my apartment without assistance from the goverment.,
lloyd,lloyd,housing,housing,affordable housing,do more to hold the commissioner accountable,
lloyd,lloyd,housing,housing,affordable housing for our artistic community. the arts are so important to the diversity of this great city,continuing making + creating and advocating for the artists + makers,
lloyd,lloyd,housing,housing,low income housing!,play an active role local elections,
lloyd,lloyd,housing,housing,"affordable housing for families and seniors as well as individuals, more home ownership programs for minorities",,
milwaukie,milwaukie,housing,housing,rent control,vote accordingly,
milwaukie,milwaukie,housing,housing,affordable housing,push towards inclusionary zone,
milwaukie,milwaukie,housing,housing,stric housing laws on landlords,work with community alliance for tenants,
milwaukie,milwaukie,housing,housing,affordable housing,support any canadite that can make that happen,
South Waterfront,south waterfront,housing,housing,Housing that hangs from cables strung over the river,Support affordable housing initiatives and design the housing myself.,
South Waterfront,south waterfront,housing,housing,Care by housing advocates for environments / resources - don't use affordable housing as an excuse,Continue to raise awareness of the need to protect fish habitat in riparian corridors - don't build on them,All neighborhoods
South Waterfront,south waterfront,housing,housing,Affordable housing,Challenge local governement to set a max rent amount,
South Waterfront,south waterfront,housing,housing,Constant awareness these are people. Be mindful most people are low income living paycheck to paycheck,Speek with people that need help and share info I know,
South Waterfront,south waterfront,housing,housing,,We can not afford full time housing with part time jobs,
South Waterfront,south waterfront,housing,housing,Affordable housing for students and homeless people,Work hard to make more and volunteer in the community.,
South Waterfront,south waterfront,housing,housing,"Options for the homeless. They are ""shipped"" to PDX from all over and we can only do so much",Help teach them to help themselves rather than aid in their current situation.,
South Waterfront,south waterfront,housing,housing,You need to help the vets. We fight for you with our lives and we need more schools for our freedom,,Corbett Oregon
South Waterfront,south waterfront,housing,housing,Housing/Facilities for homeless population,"Advocate to repurpose materials to create more infrastructure, could make an educational project",
South Waterfront,south waterfront,housing,housing,Fix the homeless problem in portland. Downtown is turning disgusting,Be willing to pay more tax to fix the problem if needed!,
South Waterfront,south waterfront,housing,housing,More affordable housing,Advocate for more affordable housing,
Overlook,overlook,housing,housing,"Control over development. Developers only seeing $$$ and uglifying neighborhoods, building mcmansions, covering whole lots, destroying heritage trees. More concetrated housing good. Ugly mansions are BAD.",? break windows? Continue complaining to city agencies who blindly refulse to listen?,
Overlook,overlook,housing,housing,Low cost housing,,
Overlook,overlook,housing,housing,Places for people to live and sleep,Do my best to give homeless people my spare change,
Overlook,overlook,housing,housing,Affordable housing - no more condos!,,
Brooklyn,brooklyn,housing,housing,Affordable housing,Vote in local elections,
Brooklyn,brooklyn,housing,housing,Affordable living. Keep PDX affordable so the people who made Portland what it is can still live here!,"Participating in community, involvement, service of announcement",
East Moreland,east moreland,housing,housing,"Zoning changes to encourage builders/developers, to build affordable housing.",,
Gateway,gateway,housing,housing,ADA ramps!,Voice my concern!,
Gateway,gateway,housing,housing,Homes/Apt/Lower Rent/Cost,Spread the word.,
Richmond,richmond,housing,housing,"New builds that are character-appropriate for our neighborhood (i.e. modestly sized, charismatic design) rather than the large condos going up (especially on Clinton).",Try to be more active in planning meetings and coordinate neighborhood efforts.,
Richmond,richmond,housing,housing,Places to put people; therefore attractive higher density housing will be needed.,,
Richmond,richmond,housing,housing,Affordable housing rent control!,Move where I can afford and commute. 1 hour and a half to drive to work which pollutes the air.,
Richmond,richmond,housing,housing,Restrictions on development,Not support the new developments on Hawthorne and Division,
Richmond,richmond,housing,housing,Land zoning for multi purpose buildings,Vote for those changes,
Reed,reed,housing,housing,Housing housing housing housing,Pass exclusionary zoning,
Reed,reed,housing,housing,"Woodstock. Fair housing, gentrifications that considers all income levels.",,
Woodstock,woodstock,housing,housing,Housing for families closer to downtown,Look for properties that I can restore,
Forest Park / Goose Hollow / Bridlemile,forest park / goose hollow / bridlemile,housing,housing,Geodesic domes with hammocks for basic weather for public,Keep writing letter to Earl Blummenaur,
Forest Park / Goose Hollow / Bridlemile,forest park / goose hollow / bridlemile,housing,housing,Better $ on apartments and housing for homeless,,
Chinatown,chinatown,housing,housing,Affordable housing,vote for people who will put caps on prices and rental increases,
Chinatown,chinatown,housing,housing,,Better $ on apartments and housing for homeless,
Chinatown,chinatown,housing,housing,Affordable housing,give my change to homeless people,
Chinatown,chinatown,housing,housing,Low income housing and more publicly known social programs to help people who are homeless and mentally ill,"be willing to pay more taxes for programs, donate materials, and volunteer my time to help these people. let's take care of everyone",
Woodlawn,woodlawn,housing,housing,"shared space housing. community, saved space through shared space","Invest in a home within my means, welcome cummunity into that space and eventually invest in new opportunities (NE Dekum)",
Woodlawn,woodlawn,housing,housing,To stop pricing native residents out of their homes,raise awareness!,
Concordia,concordia,housing,housing,Affordable houses for people to live in,Vote. advocated for programs that will fight for low-income folks,
Foster-Powell,foster-powell,housing,housing,felony friendly and affordable housing so we don't have to work 7 days a week to make rent and bills,keep on looking for an apartment or house for rent that i can only work one job,
Foster-Powell,foster-powell,housing,housing,affordable housing,vote for those who work to provide affordable housing for all of us,
Foster-Powell,foster-powell,housing,housing,affordable anti-displacing un-gentrifying housing,try to design it,
Foster-Powell,foster-powell,housing,housing,low income housing,,
Foster-Powell,foster-powell,housing,housing,affordable / low income apartments and homes,support bills to help them pass,
Foster-Powell,foster-powell,housing,housing,research how i can help attend meetings about,stop ludicrous rent increases,
Foster-Powell,foster-powell,housing,housing,"affordable houses - less displacement, not just big apartment buildings, single family houses",make prospective gentrifiers uncomfortable,
Foster-Powell,foster-powell,housing,housing,reasonable cost and increases,thank you follow up with any and all groups about this issue,
Foster-Powell,foster-powell,housing,housing,"buidling of affordable housing and apartments - not just high priced aimed for nike, intel",struggle and wait,
Foster-Powell,foster-powell,housing,housing,accesible entry-level first time homebuyer houses that are along bus lines and bike routes,look into the portland housing bureau holte program,
Foster-Powell,foster-powell,housing,housing,"original homes, not cookie-cutter developments",,
Mt. Tabor,mt. tabor,housing,housing,enforcement on subdivision of lots,encourage people in my neighborhood to take action,
Mt. Tabor,mt. tabor,housing,housing,affordable housing for low income at risk families,volunteer with a local housing advocacy group to help people be aware of their rights,
Mt. Tabor,mt. tabor,housing,housing,mental health and drug treatment facilities,support candidates who also want this.,
Mt. Tabor,mt. tabor,housing,housing,"affordable housing $700 and more per month is ridiculous, wages don't keep up. 2. housing for all these street people - our sick society needs to house these poor folks, especially families",stay where i live and hope it stays reasonable and the landlord remains compassionate,
Mt. Tabor,mt. tabor,housing,housing,affordable housing that is designed to scale and character of the surrounding neighborhood,try not to throw eggs at the monstrosity - the Yard. and i will never sell my house to a californian,
Mt. Tabor,mt. tabor,housing,housing,income restricted units in lower SE portland,actively voice my concerns over housing issues,
Mt. Tabor,mt. tabor,housing,housing,family stuff to do in portland,be able to go to places with family members,
Lents,lents,housing,housing,repairs to our homes and more beauty,help keep our neighborhoods clean and collect tras,
Lents,lents,housing,housing,zombie houses turned into fix for homelessness,ask that we forclose abandoned homes / work with owner to create housing options for unhoused,
Sellwood,sellwood,housing,housing,preservation of old portland architecture capping costs on ,,
Sellwood,sellwood,housing,housing,affordable housing i am a professional with lots of education and experience - but housing is out of reach,"hope for more apartments, to reduce the pressure on housing and return housing to a reasonable amount ""i am the disappearing middle class""",
Gresham,gresham,housing,housing,enforcement of codes on the books and other codes,update city/county codes to reflrect density to reduce light / vibrations / smoke pollution improve basic livability,
Gresham,gresham,housing,housing,affordable housing in portland. changes in pdx end up dumping on gresham,ask for more portland housing (low income). quit sending pdx problems to suburbs.,
Gresham,gresham,housing,housing,laws for landlords not to raise the rent no more,,
Sullivan's Gulch,sullivan's gulch,housing,housing,stopping the demolition of homes to put up cheap housing,stop demolition of old homes to build cheap housing i.e. holiday park plaza,
Sullivan's Gulch,sullivan's gulch,housing,housing,"affordable housing!! i was evicted from a home I built over 6 years, so they could raise rent 300%! :(",Continue to lobby my officials to remedy this! It has to stop!,
Sullivan's Gulch,sullivan's gulch,housing,housing,,who is getting paid off in the city that allows crappy construction and change of zoning laws i.e. holiday park plaza,
Ladd,ladd,housing,housing,"affordable housing, especially for elderly and marginalized communities","contact my local reps, contact the new mayor!",
Ladd,ladd,housing,housing,affordable housing,strive to learn more about how i can advocate for this,
Ladd,ladd,housing,housing,yuppies and hipsters to be rounded up and taken to california,drive the buses there,
Kerns,kerns,housing,housing,affordable homes for artists and the youth of portland who are being priced out of childhood neighborhoods,keep bringing it up :),
Hollywood,hollywood,housing,housing,controls on rent increases,know that the city is taking it seriously that people are getting kicked out of their homes,
Irvington,irvington,housing,housing,housing options for homeless / less trash work prgram = house,be loud and,
Irvington,irvington,housing,housing,"affordable housing. we have to think about increasing density, but not larger homes, integrating instead multifamily int our communities","talk to my community board, however I don't believe our mayor is listening",
Irvington,irvington,housing,housing,affordable housing for recent graduates and working class folks,resist the temptation of rent controls and instead encourage incentivise development of affordable options,
Roseway,roseway,housing,housing,respect for the history of this city and landscape stop skinny houses!,support friends of trees and restoration projects,
Roseway,roseway,housing,housing,"""respectable"" neighborhoods - fewer vagrants, strip clubs, panhandling, etc.",move away from dirty unsafe neighborhoods,
Roseway,roseway,housing,housing,stop separating lots and squeezing new houses in. keep building levels at a cap in height. keep stumptown beautiful - we like seeing our mountains,,
Parkrose,parkrose,housing,housing,low income housing safety (security guards) reasonable rent.,participate in more community meetings,
Downtown,downtown,housing,housing,housing that is affordable for everyone,,
Downtown,downtown,housing,housing,you are one way to be homeless in one paycheck gone,,
Downtown,downtown,housing,housing,"section 8 housing that is at 30% income not just ""affordable"", $1100 per month with income on SSD and SSI of $900 - yes we need more in downtown / pearl area! no more condos!",,
Downtown,downtown,housing,housing,voices supporting sun and light for everyone - no downtown full of towers,"advocate for human scale far. think Paris, not NYC",
Downtown,downtown,housing,housing,affordable housing,contact local representatives,
Downtown,downtown,housing,housing,affordable housing that's not ghetto!!!,,
Downtown,downtown,housing,housing,help and housing for the house-less and mentally ill,vote for leaders and initiatives that help address this,
Downtown,downtown,housing,housing,help for the mentally challenged and homeless :(,look into how i can volunteer,
Downtown,downtown,housing,housing,housing / services / breakthroughs with people are are living on the streets,strike up more conversations with more people who are homeless to learn about their hopes and dreams,
Downtown,downtown,housing,housing,housing and programs to help get people off the streets. actually address mental health. not just push it aside. give people resources and support to find and stay sober.,,
Downtown,downtown,housing,housing,affordable or income based housing free housing,do whatever i can in need at the moment,
Downtown,downtown,housing,housing,,cheaper apartments for section 8,
Downtown,downtown,housing,housing,a little more affordable housing,vote for sarah,
Downtown,downtown,housing,housing,permanent housing for all people who are homeless!,,
Downtown,downtown,housing,housing,housing options for homeless less trash!!! work programs equal housing,be loud and seek to understand issues on both sides,
Downtown,downtown,housing,housing,#1 homeless need to be relocated away from city center and tourism,advocate the city countil to find solutions,
Downtown,downtown,housing,housing,affordable housing in portland,tiny home home communities to eliminate homelessness,
Downtown,downtown,housing,housing,need more affordable housing apartments $500 to $800 range,keep advocating for this need for housing,
Downtown,downtown,housing,housing,preservation of historic neighborhoods,support historic preservation and historic districts,
Downtown,downtown,housing,housing,,stop sleeping outside,
Downtown,downtown,housing,housing,housing for homeless take care of our country first,vote for hillary,
Sabin,sabin,housing,housing,affordable housing above supermakerts and grocery stores like in holland and scandinavia,petition local government and local business. it's not complicated,
Beaverton,beaverton,Housing,housing,Affordable housing (i mean the rent these days...),"mosty likely need more roommates, but maybe something else? like working in an assited living home (my old job out of state)",
Beaverton,beaverton,Housing,housing,affordable housing integrated into all neighborhoods,share this message with others,
Beaverton,beaverton,Housing,housing,,housing should be cheaper here,
Beaverton,beaverton,Housing,housing,affordable housing for portland metro area,,
Beaverton,beaverton,Housing,housing,affordable housing for the middle class,eventually move to a place i can afford to live,
Beaverton,beaverton,Housing,housing,affordable housing,why not use vouchers to cover at least partial rent for low income families,
Beaverton,beaverton,Housing,housing,housing with poor people in mind,keep looking for government to fix housing,
Beaverton,beaverton,Housing,housing,affordable housing and affordable apartments being pet friendly,rent control for hard working people,
Downtown,downtown,Housing,housing,affordable housing. get my neighbors off the streets!,lobby mayor and council to enforce current rules and create new incentives for developers,
Downtown,downtown,Housing,housing,affordable high-density buildings near / with practical green community areas. so many plaza / community areas go unused due to poor design,,
Downtown,downtown,Housing,housing,eco friendly buildings in portland in housing especially,petition others to join me in making the opinion known.,
Downtown,downtown,Housing,housing,control on homeless. they are everywhere! we need more options for affordable housing.,,
Downtown,downtown,Housing,housing,affordable housing,continue working on it (county),
Downtown,downtown,Housing,housing,rent control. it's too expensive to live in this city,,
Downtown,downtown,Housing,housing,apartments and housing affordable to the average portland longtime resident (not wealthy transplant!),vote sarah. not jules or ted.,
Downtown,downtown,Housing,housing,"housing but not at the risk of losing more land. if one utilizes all the open spaces - we lose trees which absorb carbon dioxide and give off oxygen - loss also affects our health. all building and no land leads to no place for water to be absorbed and leads to flooding. high buildings lead to caverouns areas, less light which is not healthy - so I will continue to advocate for moderation and thorough thinking before adding more",,
Downtown,downtown,Housing,housing,affordable housing and less gentrification,,
Downtown,downtown,Housing,housing,solutions on / for homelessness everywhere in the city,encourage city leaders to continue on finding solutions to this complex issue,all neighborhoods
Downtown,downtown,Housing,housing,affordable spaces and community gatherings combining neighborhoods,go to more community events and forums on housing :),
Downtown,downtown,Housing,housing,affordable housing built in the portland area!volunteer or donate to local housing organizations,volunteer or donate to local housing organizations,all neighborhoods
Downtown,downtown,Housing,housing,affordable housing for the working poor. stricter guidelines for landlords and owners,continue to support our homeless and working poor,
Downtown,downtown,Housing,housing,rent controlled properties,contact the local tenants union,
Downtown,downtown,Housing,housing,mixed affordable housing downtown,work with homeless population,
Downtown,downtown,Housing,housing,power players on the ground with the homeless to understand their issues,advocate for them,
Downtown,downtown,Housing,housing,affordable large housing / apartments,advocate for higher density neighborhoods,
Northwest District,northwest district,Housing,housing,affordable housing,rent one bed to multiple people,
Downtown,downtown,Housing,housing,"affordable housing and to rething displacement of existing communities that make portland ""portland""",volunteer with my boise neighborhood association,
Downtown,downtown,Housing,housing,affordable house / lower rent for the younger generation,"speak out, be more involved in city voting",
Downtown,downtown,Housing,housing,"affordable housing for families / single mothers - more homes, less apartments",,
Downtown,downtown,Housing,housing,Housing,advocate for all homelessness in portland,
Downtown,downtown,Housing,housing,cheaper right. low income!,protest it until the city decides to get it in control,
Downtown,downtown,Housing,housing,lower housing,,
Downtown,downtown,Housing,housing,more places for the homeless to go,,
Downtown,downtown,Housing,housing,rent control,,
Downtown,downtown,Housing,housing,low income / homeless housing,sustain stability for homeless,
Downtown,downtown,Housing,housing,to address the homeless overflowing our neighborhoods and bike trails,,
Downtown,downtown,Housing,housing,rent control!!!! (don't become another san francisco),talk about it until more people listen,
Downtown,downtown,Housing,housing,affordable housing,follow the news about it,
Downtown,downtown,Housing,housing,fix (work on) the drug dealing that is common knowledge to everyone and takes place in the open,pay more taxes for increased patrol and facilities to help with addiction and help find job opportunities for people.,
Downtown,downtown,Housing,housing,affordable housing in the portland area,?,all neighborhoods
Downtown,downtown,Housing,housing,rent control. i can afford to live within an hour of my work,live with mom until i can marry rich,
Downtown,downtown,Housing,housing,localization and expansion dispersed throughout portland with housing,expand not internally but externally on portland's communities lines,
Downtown,downtown,Housing,housing,affordable housing also homeless people need transient housing,i help point out where they can get help,
Downtown,downtown,Housing,housing,"affordable housing with 2, 3, 4 bedrooms",call my councilperson,
Downtown,downtown,Housing,housing,housing for the homeless and affordable housing for all,,
Downtown,downtown,Housing,housing,less doctors - case workers - and advocates forcing people to say they are drug addicts just to get help :| wow!,am making it happen :),
Downtown,downtown,Housing,housing,"safe, secure, livable homes for portland's old and new citizens :)",... if i had the $$ money. I would purchase a home and house a few think globally act locally!,
Downtown,downtown,Housing,housing,affordable rentals / housing for artists and creatives! i live in a creative community and rents are skyrocketing. this issue is affecting my friends and my neighbors and myself. i love portland. I don't know if I will be able to afford it here.,engage and participate in discussions. i will keep my eyes and ears open for solutions and add my energy. creativity and heart can accomplish anything.,
Downtown,downtown,Housing,housing,"less high rise buildings. need more paris-like housing, portland has cut off the crown jewel views, Mount Hood and the river",fight to have the portland design committee reorganized and remove developers to minor roles,
Downtown,downtown,Housing,housing,less people stay in free or subsidized housing for a decade or longer while others cannot get help :) wow :),am making it happen :),
Downtown,downtown,Housing,housing,peace of mind about keeping our homes ....,"continue to practice gratitude, hear the people ... be the people.",
Downtown,downtown,Housing,housing,cheap housing for young people,,
Downtown,downtown,Housing,housing,clean rivers and air,"continue to vote for and be involved with those actually trying to address this and not just talk about ""plans""",
Downtown,downtown,Housing,housing,bathrooms for the homeless population,vote for more housing options,
Downtown,downtown,Housing,housing,"low income housing options for homeless and low income people. there are many homeless people on the streets here - what about tiny houses, alternatives? ",learn more engagine in dialogue about supports to empower the homeless folks downtown,
Downtown,downtown,Housing,housing,"answers for ""tent cities"" and the negative effect on portland",,
Downtown,downtown,Housing,housing,permanent and temporary affordable housing for individuals in need,lobby the portland city countil to support / enforce existing laws requiring developers to provide affordable housing,
Downtown,downtown,Housing,housing,programs to help the homeless get off the streets,talk to the mayor,
Downtown,downtown,Housing,housing,accessibility for those trying to get off the streets!,vote for hillary clinton,
Downtown,downtown,Housing,housing,affordable housing that doesn't displace businesses or other residents in that neighborhood. part of the housing issue could be relieved with a higher minimum wage,attend minimum wage workshops / affordable housing rallies unless i'm busy working so i can still pay my bills which is likely.,
Downtown,downtown,Housing,housing,affordable and transitional housing and homeless advocacy,be involved with local government and policy,
Downtown,downtown,Housing,housing,community engagement,advocate to city officials,
Downtown,downtown,Housing,housing,affordable housing and / or apartment rents,take the time to be aware of the city council's action on this and look for others concerned,
Downtown,downtown,Housing,housing,i need a house for my little family thank you.,i need donation or work for a house,
Downtown,downtown,Housing,housing,equitable houseing for those with addiction / mental illness,volunteer to raise awareness :),
